{
  "name": "MII_PR_Bildgebung_Radiologischer_Befundbericht",
  "context": {
    "code": "Radiologischer Befundbericht",
    "display": "Radiologischer Befundbericht",
    "system": "fdpg.mii.cds",
    "version": "1.0.0"
  },
  "module": {
    "code": "mii-cds-imaging",
    "display": "MII KDS Bildgebung"
  },
  "resource_type": "DiagnosticReport",
  "term_code_defining_id": "DiagnosticReport.code.coding:sct",
  "time_restriction_defining_id": "DiagnosticReport.effective",
  "attribute_defining_id_type_map": {
    "DiagnosticReport.conclusionCode": {
      "type": "",
      "optional": true
    },
    "DiagnosticReport.result": {
      "type": "reference",
      "optional": true
    },
    "DiagnosticReport.study": {
      "type": "reference",
      "optional": true
    }
  }
}