{
  "name": "Operation",
  "resource_type": "Procedure",
  "module": {
    "code": "mii-cds-Onkologie",
    "display": "Onkologie"
  },
  "context": {
    "system": "fdpg.mii.cds",
    "code": "Therapie",
    "display": "Therapie",
    "version": "1.0.0"
  },
  "term_code_defining_id": "Procedure.code.coding:sct",
  "time_restriction_defining_id": "Procedure.performed[x]",
  "attribute_defining_id_type_map": {
    "(Procedure.reasonReference).code.coding:icd10-gm": {
      "type": "reference",
      "optional": true
    }
  }
}