{
  "name": "Grading",
  "resource_type": "Observation",
  "module": {
    "code": "mii-cds-BZKF",
    "display": "BZKF"
  },
  "context": {
    "system": "bzkf.dktk.oncology",
    "code": "Grading",
    "display": "Grading"
  },
  "term_code_defining_id": "Observation.code.coding",
  "value_defining_id": "Observation.value[x]",
  "time_restriction_defining_id": "Observation.effective[x]"
}