{
  "context": {
    "code": "Mikrobiologie MRGN-Klasse",
    "display": "Mikrobiologie MRGN-Klasse",
    "system": "fdpg.mii.cds",
    "version": "1.0.0"
  },
  "module": {
    "code": "mii-cds-mikrobio",
    "display": "Mikrobiologie"
  },
  "name": "MRGN-Klasse",
  "resource_type": "Observation",
  "term_code_defining_id": "Observation.code",
  "time_restriction_defining_id": "Observation.effective[x]",
  "value_defining_id": "Observation.value[x]:valueCodeableConcept",
  "value_type": "concept",
  "attribute_defining_id_type_map": {
    "Observation.code": {
      "type": "concept",
      "optional": true
    },
    "(Observation.specimen).type.coding": {
      "type": "reference",
      "optional": true
    }
  }
}