{
  "name": "Systemtherapie",
  "resource_type": "MedicationStatement",
  "context": {
    "system": "dktk.oncology",
    "code": "Systemtherapie",
    "display": "Systemtherapie",
    "version": "1.0.0"
  },"module": {
    "code": "mii-cds-oncology",
    "display": "Onkologie"
  },
  "term_code_defining_id": "MedicationStatement.medication[x]",
  "attribute_defining_id_type_map": {
    "(MedicationStatement.extension:Intention).value[x]": "",
    "(MedicationStatement.extension:StellungZurOp).value[x]": "",
    "(MedicationStatement.extension:Protokoll).value[x]": ""
  },
  "time_restriction_defining_id": "MedicationStatement.effective[x]"
}