{
    "name": "Rechtsatrialer Druck",
    "resource_type": "Observation",
    "context": {
        "system": "fdpg.mii.icu",
        "code": "Rechtsatrialer Druck",
        "display": "Rechtsatrialer Druck",
        "version": "1.0.0"
    },
    "term_code_defining_id": "Observation.code.coding:sct",
    "time_restriction_defining_id": "Observation.effective[x]"
}