{
  "name": "GenetischeVariante",
  "resource_type": "Observation",
  "context": {
    "system": "bzkf.dktk.oncology",
    "code": "GenetischeVariante",
    "display": "Genetische Variante",
    "version": "1.0.0"
  },"module": {
    "code": "mii-cds-oncology",
    "display": "Onkologie"
  },
  "term_code_defining_id": "Observation.code.coding",
  "value_defining_id": "Observation.value[x]",
  "time_restriction_defining_id": "Observation.effective[x]"
}