{
  "context": {
    "code": "Molgen",
    "display": "Molgen",
    "system": "fdpg.mii.cds",
    "version": "1.0.0"
  },
  "module": {
    "code": "mii-cds-molgen",
    "display": "Molgen"
  },
  "name": "Bericht",
  "resource_type": "DiagnosticReport",
  "term_code_defining_id": "DiagnosticReport.conclusionCode"
}