{
  "context": {
    "code": "ICU",
    "display": "ICU",
    "system": "fdpg.mii.cds",
    "version": "1.0.0"
  },
  "module": {
    "code": "mii-cds-ICU",
    "display": "ICU"
  },
  "name": "SD_MII_ICU_Koerpergroesse",
  "resource_type": "Observation",
  "term_code_defining_id": "Observation.code.coding:loinc",
  "time_restriction_defining_id": "Observation.effective[x]",
  "value_defining_id": "Observation.value[x]:valueQuantity",
  "value_optional": false
}