{
  "name": "Gender",
  "resource_type": "Patient",
  "module": {
    "code": "bzkf-dktk-onkologie",
    "display": "Onkologie"
  },
  "context": {
    "system": "bzkf.dktk.onkologie",
    "code": "Person",
    "display": "Person",
    "version": "1.0.0"
  },
  "term_codes": [
    {
      "system": "http://snomed.info/sct",
      "code": "263495000",
      "display": "Geschlecht"
    }
  ],
  "value_defining_id": "Patient.gender",
  "value_type": "code",
  "value_optional": false
}
