{
    "name": "Puls",
    "resource_type": "Observation",
    "context": {
        "system": "fdpg.mii.icu",
        "code": "Puls",
        "display": "Puls",
        "version": "1.0.0"
    },
    "term_code_defining_id": "Observation.code.coding:sct",
    "time_restriction_defining_id": "Observation.effective[x]",
    "value_defining_id": "Observation.value[x]"
}